{"attestation":{"bundleName":"attestation-fixture-1.sigstore.json","bundleSha256":"0c98e272a4c95c4f970d1cde34cab9650dfa3c51bfbf6bd21895354683e611d2","identity":"https://github.com/acedward/midnight-binary-forge/.github/workflows/candidate.yml@refs/heads/main","issuer":"https://token.actions.githubusercontent.com","kind":"github-artifact-attestation","predicateCanonicalization":"forge-canonical-json-v1","predicateSha256":"b121a2fc23a1210d1fa441a703c1f5127958d11a93c54005d51ea29a48a18660","predicateType":"https://github.com/acedward/midnight-binary-forge/predicates/promotion-envelope/v1","subjectDigest":"sha256:b121a2fc23a1210d1fa441a703c1f5127958d11a93c54005d51ea29a48a18660","subjectName":"promotion-claims-fixture-1"},"canonicalization":"forge-canonical-json-v1","claims":{"buildSet":{"checksumsName":"sha256sums-fixture-1.txt","checksumsSha256":"5555555555555555555555555555555555555555555555555555555555555555","id":"fixture-1","manifestName":"source-manifest-fixture-1.json","manifestSha256":"4444444444444444444444444444444444444444444444444444444444444444"},"candidateDraft":{"liveImmutableVerificationRequired":true,"releaseId":300,"releaseNodeId":"RE_fixture_node","releaseUrl":"https://github.com/acedward/midnight-binary-forge/releases/tag/forge-2026.08.27.1","repository":"acedward/midnight-binary-forge","repositoryId":1349127482,"repositoryNodeId":"R_kgDOUGoNOg","tag":"forge-2026.08.27.1","targetCommitish":"2222222222222222222222222222222222222222"},"completeAssetNameListSha256":"bc2bc69a43bb04664756f2c02659c4ad1ad082ac07d2dae9bcd09e7623b06180","completeAssetNames":["LICENSE-Apache-2.0.txt","attestation-fixture-1.sigstore.json","fixture-linux-amd64-v1.0.0.zip","promotion-envelope-fixture-1.json","provenance-fixture-1.json","sbom-fixture-1.spdx.json","sha256sums-fixture-1.txt","source-manifest-fixture-1.json"],"contentAssetListSha256":"867a717069e45971055455dc73d9945eb50b69393639a3940052cd653c209df1","contentAssets":[{"mediaType":"text/plain","name":"LICENSE-Apache-2.0.txt","role":"license","sha256":"6666666666666666666666666666666666666666666666666666666666666666","size":11358},{"artifactKind":"software","componentId":"fixture-1.0.0","mediaType":"application/zip","name":"fixture-linux-amd64-v1.0.0.zip","role":"payload","sha256":"8888888888888888888888888888888888888888888888888888888888888888","size":2048},{"mediaType":"application/json","name":"provenance-fixture-1.json","role":"provenance","sha256":"9999999999999999999999999999999999999999999999999999999999999999","size":1024},{"mediaType":"application/spdx+json","name":"sbom-fixture-1.spdx.json","role":"sbom-spdx","sha256":"aaaaaaaaaaaaaaaaaaaaaaaaaaaaaaaaaaaaaaaaaaaaaaaaaaaaaaaaaaaaaaaa","size":1024},{"mediaType":"text/plain","name":"sha256sums-fixture-1.txt","role":"checksums","sha256":"5555555555555555555555555555555555555555555555555555555555555555","size":512},{"mediaType":"application/json","name":"source-manifest-fixture-1.json","role":"source-manifest","sha256":"4444444444444444444444444444444444444444444444444444444444444444","size":1024}],"contentEvidenceCount":5,"issuer":{"commitSha":"2222222222222222222222222222222222222222","ref":"refs/heads/main","repository":"acedward/midnight-binary-forge","repositoryId":1349127482,"repositoryNodeId":"R_kgDOUGoNOg","workflowPath":".github/workflows/candidate.yml","workflowSha":"1111111111111111111111111111111111111111"},"payloadCount":1,"staging":{"archiveSha256":"3333333333333333333333333333333333333333333333333333333333333333","artifactId":200,"artifactName":"verified-content-fixture-1-867a717069e45971055455dc73d9945eb50b69393639a3940052cd653c209df1","expiresAt":"2026-09-03T00:00:00Z","provider":"github-actions-artifact","runAttempt":1,"runId":100},"totalAssetCount":8,"transport":{"attestationBundleName":"attestation-fixture-1.sigstore.json","envelopeName":"promotion-envelope-fixture-1.json"},"transportAssetCount":2},"claimsDigest":"sha256:b121a2fc23a1210d1fa441a703c1f5127958d11a93c54005d51ea29a48a18660","schemaVersion":"promotion-envelope-v1"}